{
  "$schema": "https://json-schema.org/draft/2020-12/schema",
  "$id": "https://raw.githubusercontent.com/conuti-gmbh/bo4e-schema/master/schemas/v1/bo/Auftrag.schema.json",
  "title": "Auftrag",
  "type": "object",
  "properties": {
    "boTyp": {
      "$ref": "../enum/BOTyp.schema.json",
      "default": "AUFTRAG"
    },
    "versionStruktur": {
      "type": "string",
      "default": "1",
      "description": "versionStruktur"
    },
    "ausfuehrungsdatum": {
      "type": "string",
      "format": "date-time",
      "description": "ausfuehrungsdatum"
    },
    "fertigstellungsdatum": {
      "type": "string",
      "format": "date-time",
      "description": "fertigstellungsdatum"
    },
    "startdatum": {
      "type": "string",
      "format": "date-time",
      "description": "startdatum"
    },
    "sparte": {
      "$ref": "../enum/Sparte.schema.json"
    },
    "lieferanschrift": {
      "$ref": "../com/Adresse.schema.json"
    },
    "marktlokationsId": {
      "type": "string",
      "faker": {
        "string.numeric": 11
      },
      "description": "marktlokationsId"
    },
    "mindestpreis": {
      "$ref": "../com/Preis.schema.json"
    },
    "hoechstpreis": {
      "$ref": "../com/Preis.schema.json"
    },
    "energierichtung": {
      "$ref": "../enum/Energierichtung.schema.json"
    },
    "berechnungspreis": {
      "type": "number",
      "format": "float",
      "faker": {
        "number.float": {
          "multipleOf": 0.25,
          "min": 1,
          "max": 10
        }
      },
      "description": "berechnungspreis"
    },
    "summeGesamt": {
      "type": "number",
      "format": "float",
      "faker": {
        "number.float": {
          "multipleOf": 0.25,
          "min": 10,
          "max": 20
        }
      },
      "description": "summeGesamt"
    },
    "verschobenerAbmeldetermin": {
      "type": "string",
      "format": "date-time",
      "description": "verschobenerAbmeldetermin"
    },
    "behebungsZeitpunkt": {
      "type": "string",
      "format": "date-time",
      "description": "behebungsZeitpunkt"
    },
    "lieferadresseAltgeraete": {
      "$ref": "../bo/Geschaeftspartner.schema.json"
    },
    "definitionsTyp": {
      "$ref": "../enum/DefinitionsTyp.schema.json"
    },
    "positionsdaten": {
      "type": "array",
      "items": {
        "$ref": "../com/AuftragPosition.schema.json"
      },
      "description": "positionsdaten"
    },
    "bemerkungen": {
      "type": "array",
      "items": {
        "type": "string",
        "faker": {
          "lorem.sentence": 5
        }
      },
      "description": "bemerkungen"
    }
  },
  "required": [
    "boTyp",
    "versionStruktur"
  ]
}
